{"admissibility_id":"property-admissibility:repair-b19ab9eecc414fdbab6acc39ce30e53f:set-window-fire-rating:claim-001","authoritative_record_id":"ifc2x3:Pset_WindowCommon.FireRating","candidate_set_id":"property-candidates:repair-b19ab9eecc414fdbab6acc39ce30e53f:set-window-fire-rating:claim-001","checks":{"authoritative_record_present":true,"conflict_resolved":true,"minimum_retrieval_quality_met":true,"occurrence_scope_supported":true,"offered_candidate":true,"scalar_template_supported":true,"target_class_applicable":true,"unit_compatible":true,"value_type_compatible":true},"decision_id":"property-decision:repair-b19ab9eecc414fdbab6acc39ce30e53f:set-window-fire-rating:claim-001","policy_id":"ifc2x3.single-value.vector-reranker","policy_version":"0.2","query_id":"property-query:repair-b19ab9eecc414fdbab6acc39ce30e53f:set-window-fire-rating:claim-001","reason_code":"PROPERTY_ADMISSIBLE","schema_version":"text2ifc/ifc-property-admissibility/0.1","selected_candidate_id":"candidate:2:ifc2x3:Pset_WindowCommon.FireRating","status":"passed"}
